id,identificador,descripcion,solucion,criticidad,vector_cvss_base,cwe,referencias,organizacion,creado,actualizado,componentes_relacionados
1,XXX-2026-0001,Validación insuficiente en el portal web permite XSS almacenado,Actualizar a XXX Web Portal 1.4.3 y habilitar cabeceras CSP,7.5,AV:N/AC:L/PR:L/UI:R/S:C/C:H/I:H/A:N,CWE-79,https://example.com/advisories/XXX-2026-0001,XXX SA,2026-06-02T08:00:00Z,2026-06-02T09:00:00Z,"1;3"
2,XXX-2026-0002,Deserialización insegura en XXX Core Framework permite RCE,Actualizar a XXX Core Framework 3.2.1,9.0,AV:N/AC:L/PR:N/UI:N/S:U/C:H/I:H/A:H,CWE-502,https://example.com/advisories/XXX-2026-0002,XXX SA,2026-06-02T08:10:00Z,2026-06-02T09:05:00Z,"2"
3,XXX-2026-0003,Configuración por defecto del API Gateway permite enum. de tokens,Aplicar la plantilla de configuración reforzada y rotar claves,6.8,AV:N/AC:L/PR:L/UI:N/S:U/C:H/I:N/A:N,CWE-284,https://example.com/advisories/XXX-2026-0003,XXX Signalling,2026-06-02T08:20:00Z,2026-06-02T09:10:00Z,"3;4"
4,XXX-2026-0004,Dependencia vulnerable en la imagen base afecta OpenSSL,Reconstruir imágenes con la versión parcheada de OpenSSL,8.2,AV:N/AC:L/PR:N/UI:N/S:U/C:H/I:H/A:H,CWE-676,https://example.com/advisories/XXX-2026-0004,XXX DS,2026-06-02T08:30:00Z,2026-06-02T09:20:00Z,"1;2;3;4;5"
5,XXX-2026-0005,Gestión insegura de sesiones en el servicio de autenticación,Actualizar a XXX Auth Service 1.0.1 y endurecer cookies,7.8,AV:N/AC:L/PR:L/UI:N/S:U/C:H/I:H/A:N,CWE-384,https://example.com/advisories/XXX-2026-0005,XXX P&A,2026-06-02T08:40:00Z,2026-06-02T09:25:00Z,"1;4"
